id,brand,description,name,price
495,maybelline,"Maybelline Facestudio Master.
",Maybelline Facestudio Master Contour Kit,15.99
477,maybelline,Lippie Pencil A long-wearing and high-intensity lip pencil that glides on,Lippie Pencil,5.00
488,maybelline,All of our products are free ,Lipstick,26.00
468,maybelline,12 hours of long-lasting intense color,Liquid Liner,1.00
439,maybelline,Maybelline Face Studio Master Hi-Light Light ,Maybelline Face Studio Master Hi-Light Light Booster Bronzer,14.79
